{
  "kind": "gridwork.skill",
  "id": "contract-first-boundaries",
  "name": "Contract First Boundaries",
  "version": "0.1.0",
  "description": "Materializes only approved boundary contracts with known consumers before functional implementation.",
  "category": "architecture-foundation",
  "allowedAgents": ["architecture-foundation-agent"],
  "allowedWorkflows": ["architecture-foundation"],
  "requiredInputs": ["approved_boundary_design", "known_consumers", "first_slice_needs"],
  "producedOutputs": ["required_boundary_contracts", "contract_traceability"],
  "artifactPaths": [".factory/runs/<run-id>/artifacts/architecture-foundation/contracts/"],
  "toolPolicyRefs": ["../../policies/architecture-foundation-policy.md"],
  "humanGates": ["public_contract_decision", "architecture_decision", "scope_change"],
  "permissionsInheritedOnly": true
}
