{
  "kind": "gridwork.skill",
  "id": "uml-html-diagrams",
  "name": "UML HTML Diagrams",
  "version": "0.1.0",
  "description": "Creates optional self-contained HTML UML sequence, state, activity or class diagrams for focused architecture questions.",
  "category": "architecture-diagram",
  "allowedAgents": ["software-architect"],
  "allowedWorkflows": ["architecture-ddd"],
  "requiredInputs": ["diagram_goal", "approved_architecture_model", "uml_type"],
  "producedOutputs": ["uml_html_diagram", "diagram_notes"],
  "artifactPaths": [".factory/runs/<run-id>/artifacts/architecture/diagrams/", "docs/architecture/diagrams/"],
  "toolPolicyRefs": ["../../policies/diagram-html-policy.md"],
  "humanGates": ["approved_architecture_publish"],
  "permissionsInheritedOnly": true
}
