{
  "kind": "gridwork.skill",
  "id": "project-scaffolding",
  "name": "Project Scaffolding",
  "version": "0.1.0",
  "description": "Creates an approved minimal executable project and module structure without implementing business behavior.",
  "category": "architecture-foundation",
  "allowedAgents": ["architecture-foundation-agent"],
  "allowedWorkflows": ["architecture-foundation"],
  "requiredInputs": ["approved_foundation_plan", "confirmed_stack", "approved_paths", "command_allowlist"],
  "producedOutputs": ["minimal_executable_structure", "scaffolding_evidence"],
  "artifactPaths": [".factory/runs/<run-id>/artifacts/architecture-foundation/scaffolding/"],
  "toolPolicyRefs": ["../../policies/architecture-foundation-policy.md", "../../policies/tool-allowlist.md"],
  "humanGates": ["product_structure_write", "dependency_change", "infra_file_write", "unknown_command"],
  "permissionsInheritedOnly": true
}
